mediaid,tags
2c369,"[u'nu disco', u'electronic', u'indie', u'german']"
2c3b0,"[u'hip hop', u'rap', u'philly', u'meek mill']"
2c135,"[u'indie', u'rock', u'punk', u'hardcore', u'pop', u'singer-songwriter', u'alternative', u'alternative pop', u'american', u'synthpop']"
2c0ff,"[u'indie rock', u'electronic', u'indie', u'synthpop', u'australian']"
2c3tm,"[u'pop', u'electronic', u'swedish', u'female vocalist', u'dance']"
2c05m,[u'electronic']
2c48m,"[u'indie', u'electronic', u'chillout', u'need to scrobble', u'downtempo']"
2c2wx,"[u'moombahton', u'dubstep', u'electro house', u'electro', u'electronic', u'electronica']"
15sj5,"[u'house', u'nu-disco', u'hipster dance party', u'dance dance dance', u'getupanddance', u'upbeat', u'awesome']"
2bamw,"[u'electronic', u'synthpop', u'street punk', u'indie dance', u'punk', u'dance', u'electronica', u'indie', u'house', u'nu disco']"
2a90h,"[u'hardcore', u'jd beatty', u'brett lane', u'2009', u'garage psychedelic', u'robby fronzo', u'5432fun', u'tempe', u'60s garage', u'shitcore']"
2c2fa,"[u'chillwave', u'electronic', u'lo-fi', u'psychedelic', u'electronica']"
2c1kb,"[u'experimental', u'electronic', u'indie', u'downtempo', u'kid a-esque']"
2b8vq,"[u'soul', u'electronic', u'cosmic dubstep', u'indie pop']"
2bxam,"[u'pop', u'hip hop']"
22ksd,"[u'lo-fi', u'psychedelic', u'folk', u'experimental', u'garage rock', u'psychedelic rock']"
2bt0t,"[u'electronic', u'indie', u'psychedelic', u'alternative', u'indie pop']"
2c1g8,"[u'experimental', u'psychedelic', u'freak folk', u'indie', u'folk']"
2c14y,"[u'house', u'progressive house', u'club', u'dance', u'electro house']"
2c09y,[u'electronic']
2c3ac,"[u'pop', u'electronic', u'swedish', u'female vocalist', u'dance']"
2c1d3,"[u'chillwave', u'electronic', u'lo-fi', u'psychedelic', u'electronica']"
2c24a,"[u'hip hop', u'rhythm and blues', u'rap', u'bitch house']"
2c41v,"[u'rap', u'hip hop', u'trap', u'rhythm and blues']"
2c367,"[u'hip hop', u'rap', u'underground hip hop', u'swag', u'new york']"
2c389,"[u'house', u'progressive house', u'electronic', u'swedish', u'dance']"
2ahss,"[u'psychedelic rock', u'psychedelic', u'indie rock', u'australian', u'rock']"
zjt7,"[u'psychedelic rock', u'rock', u'alternative rock', u'indie rock', u'2010s', u'psychedelic', u'indie', u'garage rock', u'alternative', u'fuck yeah']"
yqkf,"[u'animal kingdom', u'indie', u'canadian', u'2010s', u'psychedelic rock', u'shoegaze', u'alternative', u'magic female voice', u'animals', u'warm veins']"
25hg1,"[u'stoner rock', u'psychedelic rock', u'stoner', u'rock', u'psychedelic']"
2c3pf,"[u'r&b', u'ambient', u'soul', u'alternative', u'underground', u'polish', u'rhythm and blues', u'rap', u'chillwave']"
2c3mc,"[u'indie', u'british', u'soul', u'electronic']"
29gay,"[u'alt-country', u'punk rock', u'kill rock stars', u'grunge', u'country', u'folk', u'punk', u'female vocalist', u'need to check', u'art punk']"
21rvk,"[u'lo-fi', u'indie', u'surf rock', u'surf', u'alt-country', u'indie rock']"
27cmn,"[u'indie', u'alt-country', u'americana', u'kickasstic', u'pay attention', u'nashville', u'recommended', u'folk', u'female vocalist', u'spacebomb']"
27msa,"[u'folk', u'indie', u'folk rock', u'alt-country', u'indie folk']"
2bmqa,"[u'shoegaze', u'indie', u'doomcore', u'indie pop', u'darkcore', u'lo-fi', u'post-punk']"
30xf,"[u'alt-country', u'folk', u'americana', u'california', u'indie', u'country', u'alt country', u'mellow', u'woody guthrie', u'wilco']"
k47r,"[u'folk', u'indie', u'folk rock', u'alt-country', u'campfire', u'singer-songwriter', u'acoustic', u'indie folk', u'chill', u'1818']"
20jv6,"[u'folk', u'singer-songwriter', u'indie', u'americana', u'indie rock', u'indie folk', u'alt-country']"
2atnn,"[u'psychedelic rock', u'psychedelic', u'indie rock', u'australian', u'rock']"
2aade,"[u'lo-fi', u'psychedelic', u'indie rock', u'indie', u'alternative', u'psychedelic rock']"
24y1z,"[u'experimental', u'jazz', u'funk', u'psychedelic rock', u'psychedelic', u'rock']"
29adb,"[u'lo-fi', u'psychedelic', u'indie rock', u'indie', u'alternative', u'psychedelic rock']"
20jvd,"[u'psychedelic', u'neo-psych', u'stoner rock', u'indie rock', u'indie', u'psychedelic rock']"
2a1mf,"[u'psychedelic rock', u'psychedelic', u'indie rock', u'australian', u'rock']"
2avcn,"[u'lo-fi', u'psychedelic', u'indie rock', u'indie', u'alternative', u'psychedelic rock']"
27ams,"[u'dreampop', u'chillwave', u'lo-fi', u'ambient', u'experimental']"
2bfxf,"[u'indie', u'psychedelic rock', u'alternative', u'indie rock', u'danceable', u'philly', u'catchy', u'psychedelic']"
227j1,"[u'electronic', u'reggae', u'dub', u'electro']"
25xk6,"[u'electronic', u'synthpop', u'street punk', u'indie dance', u'punk', u'electronica', u'dance', u'house', u'nu disco', u'electropop']"
26gx7,"[u'60s', u'house', u'psychedelic', u'electronic', u'pop', u'disco', u'nu disco', u'psychedelic rock', u'american']"
2bwyg,"[u'downtempo', u'lo-fi', u'post-dubstep', u'smooth', u'shoegaze hip hop', u'electronic']"
2bwjt,"[u'house', u'electronic', u'vaporwave', u'lo-fi', u'chillwave']"
2btxp,"[u'chillwave', u'electronic', u'lo-fi', u'psychedelic', u'electronica']"
2b1kk,"[u'indie pop', u'lo-fi', u'indie', u'beach rock', u'california']"
2b5et,"[u'lo-fi', u'psychedelic', u'experimental', u'tropical', u'drone']"
29q40,"[u'future garage', u'electronic', u'dubstep', u'experimental', u'lo-fi']"
28ykp,"[u'chillwave', u'electronic', u'lo-fi', u'psychedelic', u'electronica']"
2bnef,"[u'indie', u'dreampop', u'indie pop', u'shoegaze', u'dreamy', u'experimental', u'electronica']"
1t7dh,"[u'electronic', u'street punk', u'synthpop', u'indie dance', u'punk', u'electronica', u'dance', u'disco', u'nu disco', u'house']"
29s5a,"[u'electronic', u'synthpop', u'street punk', u'indie dance', u'punk', u'dance', u'electronica', u'house', u'nu disco']"
2aews,"[u'electronic', u'synthpop', u'street punk', u'indie dance', u'punk', u'dance', u'electronica', u'house', u'nu disco']"
2654z,"[u'electronic', u'synthpop', u'street punk', u'indie dance', u'punk', u'electronica', u'dance', u'house', u'nu disco', u'electropop']"
trz4,"[u'electronic', u'indie', u'alternative', u'dub', u'female vocalist']"
2b5tf,"[u'indie', u'electronic', u'deep house', u'neo-soul', u'dreampop', u'listen']"
1696z,[u'rohitcagarwal']
2bk4b,"[u'electronic', u'chillout', u'instrumental hip hop', u'australian', u'hip hop', u'wonky']"
2bzvm,"[u'electronic', u'house', u'chillout', u'disco house', u'funk']"
2bzkc,"[u'electronic', u'reggae', u'dub', u'electro']"
2b9ng,"[u'r&b', u'electronic', u'pop', u'powerpop', u'power pop', u'hip hop']"
2bd2b,"[u'chillout', u'house', u'electronic']"
2ax54,"[u'mello music group', u'alternative rap', u'underground rap']"
2c2et,"[u'ambient', u'electronic', u'experimental', u'techno', u'downtempo']"
228mk,"[u'rhythm and blues', u'soul', u'r&b', u'hip hop', u'miguel']"
21hnn,"[u'drum and bass', u'dubstep', u'british', u'uk funky', u'electronic']"
t8q4,"[u'hip hop', u'rap', u'dc']"
226ye,"[u'electronic', u'house', u'disco house', u'chillout', u'funk']"
2b9jx,"[u'electronic', u'pop', u'electro house', u'house', u'american', u'selfie', u'instagram', u'united states', u'alternative dance']"
2b6yd,"[u'hip hop', u'rap', u'funk', u'soul']"
2bzsd,"[u'pop', u'rhythm and blues', u'female vocalist', u'dance', u'soul']"
265r5,"[u'indie', u'indie rock', u'indie pop', u'surf rock', u'pop']"
229ha,"[u'happy dance', u'pop', u'indie', u'alternative', u'indie rock', u'happy', u'2010s', u'2014', u'hollister', u'male vocalists']"
2b8z0,"[u'indie', u'electronic', u'need to scrobble', u'chillout', u'downtempo', u'female vocalist']"
2bbc8,"[u'female vocalist', u'chillout', u'indie', u'downtempo', u'trip-hop', u'australian']"
2ba6s,"[u'trap', u'electronic', u'experimental', u'heavy']"
2baq6,"[u'electronic', u'hip hop', u'trip-hop', u'ninja tune', u'electronica']"
2b92r,"[u'pop', u'swedish', u'electronic', u'female vocalist', u'indie']"
2b9xa,"[u'electronic-lounge', u'groove', u'minnesota', u'sxsw 2010s', u'nu-bluz', u'nu disco', u'electro', u'indie', u'american']"
2b8xm,"[u'electronic', u'indie pop', u'downtempo', u'dreampop', u'british', u'years']"
2c03e,"[u'electro', u'disco', u'retro-electro', u'dance', u'electronic', u'valerie']"
29w6h,"[u'folk', u'australian', u'indie folk', u'singer-songwriter', u'indie', u'female vocalist']"
2c1r6,"[u'funk', u'soul', u'metalcore', u'stones throw']"
229wz,"[u'icelandic', u'rock', u'female vocalist', u'iceland', u'icelandic rock']"
247x6,"[u'chillwave', u'lo-fi', u'electronic', u'synthpop', u'chillout']"
1rmtg,[u'los angeles']
4t74,"[u'electronic', u'instrumental', u'indie', u'electronica', u'electro', u'dance', u'ratatat', u'indietronica', u'guitar', u'rock']"
1410v,"[u'french house', u'house', u'french touch', u'rap', u'disco', u'disco house', u'torun', u'poka', u'electronic']"
skyq,"[u'electro', u'indie pop', u'dance', u'electronic', u'disco', u'check out again', u'fun', u'highly bloggable electro']"
110ex,"[u'folk', u'bluegrass', u'thrashgrass', u'indie pop', u'alt-country', u'indie', u'country', u'minnesota', u'energetic', u'americana']"
45qw,"[u'britpop', u'rock', u'90s', u'british', u'oasis', u'alternative', u'indie', u'alternative rock', u'indie rock', u'pop']"
2c10q,"[u'hip hop', u'rap', u'shitty anal gaycore']"
296pt,"[u'hip hop', u'rap', u'chicago', u'jazz rap']"
2bzm1,"[u'indie', u'indie pop', u'british']"
2c221,"[u'electronic', u'indie', u'british', u'electropop']"
2c228,"[u'rap', u'hip hop', u'conscious hip hop']"
2by5n,"[u'electronic', u'indie', u'indie pop']"
24te4,"[u'visual kei', u'j-rock', u'jrock']"
2bzty,"[u'pop', u'russian', u'dance', u'90s', u'russian pop', u'electronic']"
2c2a8,"[u'hip hop', u'rap', u'west coast']"
2c298,"[u'rhythm and blues', u'electronic', u'dubstep', u'canadian', u'prog-rhythm and blues']"
2aynk,"[u'rap', u'hip hop', u'conscious hip hop']"
sqpk,"[u'electronic', u'top quality', u'disco', u'ion b radio', u'mind-blowing shit', u'electronica', u'electro', u'trippy', u'dance', u'gorgeousness']"
v81m,"[u'rap', u'motivational', u'eminem', u'678-74-311-75', u'dirty south', u'hip hop', u'golephish', u'drake', u'dj dumbass']"
27mzc,"[u'electronic', u'chillout', u'ambient', u'electronica', u'norwegian']"
25z92,"[u'dreampop', u'folk', u'acoustic', u'indie', u'experimental']"
26eye,"[u'soul', u'rhythm and blues', u'blues', u'60s', u'oldies']"
1agk1,"[u'indie pop', u'indie']"
smtq,"[u'house', u'favourite remixes', u'electro']"
1b9zx,"[u'hip hop', u'rap', u'alternative rap', u'house']"
6fnn,"[u'folk', u'indie', u'indie folk', u'gypsy', u'balkan', u'alternative', u'beautiful', u'beirut', u'singer-songwriter', u'summer']"
205k2,"[u'hip hop', u'rap', u'underground hip hop', u'alternative rap']"
204z0,"[u'indie', u'electro', u'perth', u'cut copy', u'the presets', u'crystal castles', u'van she', u'sun city', u'grafton primary', u'crooked colours']"
11f4z,"[u'dirty south', u'hip hop', u'rap', u'southern rap', u'houston', u'ugk']"
27170,"[u'indie', u'female vocalist', u'british', u'alternative']"
12nm7,"[u'electro', u'electronic', u'fidget house', u'house', u'dance', u'electronica']"
176za,"[u'electronica', u'downtempo', u'nu rave', u'downbeat', u'electro']"
26x11,"[u'indie', u'indie pop', u'electropop', u'electronic', u'electronica']"
26by0,"[u'dreampop', u'indie', u'indie pop', u'chillout', u'lastfmsc', u'american']"
26khp,"[u'hip hop', u'rap', u'underground hip hop']"
25e7m,"[u'folk', u'acoustic', u'singer-songwriter']"
2651y,"[u'electronic', u'moombahton', u'brujahton']"
1n80b,"[u'post rock', u'math rock', u'noise rock']"
26dqh,"[u'electronic', u'idm', u'ambient', u'experimental', u'electronica']"
td31,"[u'house', u'for later', u'electro house', u'remix', u'electronic', u'electro']"
tjvw,"[u'hip hop', u'rap', u'chill', u'public enemy', u'soundtrack', u'90s', u'new york', u'old school', u'american', u'explicit']"
22m21,"[u'pop', u'indie pop', u'weird canada', u'5432fun', u'lo-fi', u'indie', u'psychedelic pop', u'folk', u'dreampop']"
260dr,"[u'indie pop', u'indie', u'twee', u'female vocalist', u'acoustic']"
27ehz,"[u'trap', u'electronic', u'bass']"
16hr5,"[u'indie', u'alternative rock', u'indie rock', u'sonic rock', u'aitch', u'chill', u'aitchknight', u'aitchsonic', u'moonh8sun', u'aitchchill']"
rhs4,"[u'jay-z', u'hip hop', u'state property']"
27qph,"[u'electronica', u'indie', u'electronic', u'electro', u'dark', u'try']"
w4d2,"[u'2010s', u'rel-mnth:2010s:november', u'so funky', u'soul', u'monte carlo nightss', u'neo soul', u'bbe']"
1e7j4,"[u'2010s', u'indie rock', u'indie', u'alternative', u'2011', u'radioeins', u'21st century rock', u'indie pop', u'rock', u'alternative rock']"
1993j,"[u'hip hop', u'aitchknight', u'moonh8sun', u'aitch', u'aitchrap', u'lupe fiasco', u'alternative rap', u'cool down', u'2010s', u'chicago']"
17a3h,"[u'winter', u'come on winter', u'the elements', u'christmas']"
1b0e2,[u'cover']
26txn,"[u'indie', u'indie pop', u'electropop', u'electronic', u'electronica']"
26a2r,"[u'indie', u'indie rock', u'alternative', u'rock', u'american']"
tqc7,"[u'chill', u'indie', u'remix', u'electronic', u'indie pop', u'acoustic', u'mellow', u'downtempo', u'norwegian', u'kings of convenience']"
26vk9,"[u'hip hop', u'underground hip hop', u'rap', u'new york']"
26tj0,"[u'hip hop', u'rap', u'dirty south', u'southern rap']"
zk4s,"[u'adversity', u'chill', u'ambition', u'city', u'women']"
8fyp,"[u'soul', u'60s', u'oldies', u'rhythm and blues', u'motown', u'otis redding', u'blues', u'male vocalists', u'mellow']"
ec8e,"[u'cover', u'indietronica', u'cover version', u'jimmy', u'best of 2008-9', u'indie electronica', u'oh-cover', u'cocktails at sunset', u'excellent song', u'mamma g radio']"
q66h,"[u'indie rock', u'indie', u'indie pop', u'00s', u'indie-rock', u'rock', u'alternative', u'vampire weekend', u'american', u'reggae']"
23tcs,"[u'nu disco', u'electronic', u'electropop', u'electronica', u'synthpop', u'nu-disco', u'indie dance', u'disco', u'indietronica', u'dance']"
26t41,"[u'electronic', u'electropop', u'uk', u'iran', u'contemporary r&b', u'indie', u'electronica']"
26n5b,"[u'electronic', u'synthpop', u'street punk', u'indie dance', u'punk', u'dance', u'electronica', u'house', u'nu disco', u'electropop']"
63cw,"[u'acoustic', u'indie', u'chillout', u'mellow', u'kings of convenience', u'indie pop', u'folk', u'norwegian', u'relaxing', u'alternative']"
20cjh,"[u'dreampop', u'indie', u'chillout', u'indie pop', u'lastfmsc', u'american', u'female-vocalist']"
26rsp,"[u'electronic', u'rock', u'pop', u'duo']"
26t7k,"[u'chillwave', u'electronic', u'glo-fi', u'ambient', u'electronica']"
26tye,"[u'house', u'electro house', u'electronic', u'electro', u'dance']"
261f8,"[u'indie', u'electronic', u'british', u'alternative', u'indie pop']"
26wg0,"[u'pop', u'indie pop', u'electronic', u'indie', u'new zealand', u'female vocalist']"
26mpj,"[u'electronic', u'electro', u'electronica', u'chillout', u'thesixtyone']"
tet1,"[u'britpop', u'rock', u'indie', u'alternative', u'british']"
j17x,[u'wonky']
1a8tr,"[u'rock', u'11', u'alternative', u'folk']"
1aajv,"[u'f50 2011', u'2010s', u'2011']"
1faj,"[u'alternative', u'80s', u'rock', u'indie', u'alternative rock', u'violent femmes', u'indie rock', u'punk', u'fun', u'post-punk']"
sk35,"[u'indie', u'pop', u'funky', u'vintage', u'funk', u'soul', u'blue sky days', u'2000s', u'summertime', u'oifm']"
qp90,"[u'indie', u'indie pop', u'french', u'electronic', u'dance', u'summer', u'catchy', u'indie rock', u'pop', u'rock']"
vhfh,"[u'collaborations', u'00s', u'hip hop', u'pursuit of happiness', u'mgmt']"
22ejp,"[u'ambient', u'indie', u'electro', u'alternative rock', u'belgian', u'hip hop', u'alternative', u'rock', u'electronic']"
236gd,"[u'electro house', u'electro', u'dubstep', u'house', u'electronic']"
2374v,"[u'indie pop', u'female vocalist', u'swedish', u'electronic', u'pop', u'indie']"
23781,"[u'indie pop', u'electronic', u'indie', u'female vocalist', u'british']"
236m2,"[u'indie', u'indie pop', u'female vocalist', u'indie rock', u'soul', u'pop']"
236kx,"[u'indie', u'house', u'electronica', u'australian', u'nu disco']"
mrhv,"[u'ethereal', u'downtempo', u'dreamy', u'minnesota', u'mesmerizing', u'shimmery', u'chillout', u'fluorescent', u'minneapolis', u'hypnotic']"
1fz16,[u'my shit']
s486,"[u'indie', u'french', u'catchy', u'dance', u'indie pop', u'indie rock', u'alternative', u'electronic', u'pop', u'phoenix']"
r4gh,"[u'indie pop', u'todorcicl', u'indie', u'electronic', u'indie rock']"
w7mw,"[u'mashup', u'rock', u'rap']"
23wf2,"[u'folk', u'indie', u'pop', u'singer-songwriter', u'indie folk', u'male vocalists', u'the bedford']"
24jdj,"[u'hip hop', u'rap', u'underground hip hop']"
rtw7,"[u'indie', u'electronic', u'indietronica', u'indie pop', u'electro', u'electropop', u'pop', u'female vocals', u'indiena sound', u'edit']"
pdpr,"[u'electronic', u'happy', u'catchy', u'cheerful', u'uplifting', u'electronica', u'norwegian', u'chillout', u'r\xf6yksopp', u'awesome']"
1kze6,"[u'electronic', u'pop', u'female vocalist', u'indie pop', u'indie', u'british', u'electronica', u'britpop']"
1f545,"[u'house', u'electronic', u'french']"
j6kn,"[u'hip hop', u'female vocalist', u'pop-hop', u'diplo', u'vocal', u'club misfits', u'free-hop', u'rhymes', u'fem rap', u'remixes']"
234rw,"[u'experimental', u'beats', u'abstract', u'spacehop', u'electronic']"
1m1bd,"[u'dubstep', u'dub', u'epic']"
20xm4,"[u'indie rock', u'folk', u'indie', u'folk rock', u'rock']"
238f5,"[u'indie', u'electropop', u'electronic', u'indie pop', u'electronica']"
237kw,"[u'electro', u'seductive', u'dark-ish', u'again', u'under 5000 listeners', u'dar paklausyti daugiau']"
236fk,"[u'folk', u'indie', u'singer-songwriter', u'pop', u'under 2010s0 listeners']"
1zm6w,"[u'swedish', u'rap', u'hip hop', u'roskilde 07', u'roskilde 2007', u'ghettotech']"
1z53b,"[u'hip hop', u'rap', u'electronic', u'female vocalist', u'hip-house']"
205p1,"[u'female vocalist', u'malaysian', u'indie', u'folk', u'acoustic', u'singer-songwriter', u'malaysia']"
205dd,"[u'hip hop', u'rap', u'rhythm and blues', u'canadian']"
204ky,"[u'indie', u'experimental', u'pop', u'alternative', u'indie pop', u'male vocalists']"
2055a,"[u'hip hop', u'rap', u'soul', u'alternative rap']"
205f7,"[u'quirky', u'indie folk', u'folk', u'good tims', u'instant feel-good', u'insane happiness', u'indie', u'indie rock', u'fun music', u'hand clapping']"
1ksca,"[u'hip hop', u'funk', u'blues', u'jazz', u'soul', u'chicago']"
1ksjr,"[u'female vocalist', u'indie', u'indie pop', u'alternative', u'folk', u'british']"
1ksb9,"[u'indie rock', u'experimental', u'indie', u'freak folk', u'avant-garde']"
1d055,"[u'house', u'electronic', u'progressive house', u'electro', u'minimal']"
1ks3x,"[u'groovy', u'grove punk', u'trippy', u'stoner rock']"
1ks63,"[u'pop', u'british', u'psychobilly', u'garage rock', u'the wanted']"
1kr6z,"[u'female vocalist', u'indie', u'indie pop', u'pop', u'alternative']"
1krb0,"[u'minimal techno', u'minimal', u'house', u'progresive house', u'dance', u'electronica', u'electronic', u'electro']"
11sem,"[u'indie', u'indietronica', u'electronic', u'summer', u'2010s', u'a good day', u'dance', u'british', u'indie pop', u'night driving']"
1m1d0,"[u'electronic', u'brazilian', u'electroclash', u'electro', u'electropop']"
1ky0n,"[u'dubstep', u'electronic', u'electro']"
1m0a7,"[u'surf shit', u'stoner', u'greensboro']"
1kzn8,"[u'hip hop', u'rap', u'indie', u'underground hip hop']"
1kzfe,"[u'house', u'electronic', u'electro', u'techno', u'electronica']"
1m0ab,"[u'shoegaze', u'electronic', u'indie', u'dreampop', u'pop', u'post-rock', u'electronica', u'dreamy', u'rock', u'00s']"
1kzak,"[u'street punk', u'electronic', u'punk', u'melodic punk', u'00s', u'pop']"
1k8g5,"[u'indie', u'british', u'disco', u'electronic', u'uk', u'united kingdom']"
1kqq6,"[u'experimental', u'indie', u'chillwave', u'dreampop', u'avant-garde']"
1ksgh,"[u'90s', u'rock', u'pop', u'female vocalist', u'alternative', u'no doubt', u'ska', u'sad', u'alternative rock']"
1ktar,"[u'house', u'electro house', u'epic', u'dance', u'electronic', u'metalcore', u'electro', u'pure awesome']"
1ks44,"[u'tropical', u'lo-fi', u'experimental']"
1krp8,"[u'dubstep', u'electronic', u'bass']"
1ks0q,"[u'hip hop', u'rap', u'kansas', u'xv']"
1krzh,"[u'female vocalist', u'indie', u'canadian', u'singer-songwriter', u'pop', u'indie pop', u'cover', u'feist', u'mellow', u'chillout']"
1ks5c,"[u'chillwave', u'dreampop', u'electronic', u'indie', u'glo-fi']"
1ks6g,"[u'reggae', u'roots reggae']"
1kbc4,"[u'hip hop', u'rap', u'alternative rap']"
1kbzc,"[u'african', u'world', u'mali', u'sennik', u'world music', u'mellow', u'melancholic']"
1ksas,"[u'electro', u'electronic', u'dirty electro', u'canadian', u'house']"
1ks5y,"[u'singer-songwriter', u'indie', u'alternative', u'melodic', u'rock']"
1kr1b,"[u'indie', u'indie pop', u'alternative', u'american']"
1eahn,"[u'electronic', u'electro', u'audio video disco', u'justice', u'ed banger records', u'radio4265', u'other level', u'french', u'rock', u'electronica']"
1ddwn,"[u'chillwave', u'electronic', u'psychedelic', u'electropop', u'alternative', u'best of 2011', u'videogame', u'indie pop', u'lo-fi', u'electronica']"
1e8a9,"[u'hip hop', u'2011', u'hood', u'my addictionz', u'situations', u'wiz khalifa', u'featuring', u'5']"
1erev,"[u'house', u'summer', u'piano']"
1egj6,"[u'best of 2011', u'missy elliott', u'hip hop', u'rap', u'j cole']"
1dwev,"[u'indie', u'female vocalist', u'british', u'alternative', u'beautiful', u'indie rock', u'indie pop', u'awesome', u'pop', u'fucking awesome']"
1gff0,"[u'pop', u'dance', u'electropop', u'female vocalist', u'electronic']"
1jphx,"[u'house', u'electronic', u'dance', u'electro house', u'electro']"
1g64b,"[u'rock', u'alternative', u'blues', u'soul', u'acoustic']"
1ffz9,"[u'hip hop', u'hassanmcmillan', u'rap']"
1g6nk,"[u'francaisgdchill', u'personal favourites']"
1g5vx,[u'dubstep']
1g7r0,"[u'mashup', u'dance']"
1fz31,"[u'folk', u'female vocalist', u'british', u'indie', u'singer-songwriter']"
1g53y,"[u'2012', u'male vocalists', u'lust', u'2010s', u'groove nation', u'dance', u'hip hop', u'american', u'2011', u'pop']"
1bgn6,"[u'alt-country', u'singer-songwriter', u'female vocalist', u'indie', u'folk', u'country', u'americana']"
1bem2,"[u'singer-songwriter', u'alt-country', u'rock', u'indie', u'folk']"
1epjs,"[u'indie', u'electronic', u'indie rock', u'post-punk', u'dance', u'dance-punk', u'rock']"
1e2kk,"[u'dubstep', u'mashup', u'zeds dead', u'female vocalist']"
1fbqe,"[u'male vocalists', u'cover', u'indie']"
1f4am,"[u'hip hop', u'rap', u'kanye west', u'jay-z']"
1etbs,"[u'house', u'groovy', u'night music', u'summer', u'club', u'dance', u'disco house', u'disco influence', u'piano']"
1f4xw,"[u'indie', u'indie rock', u'indie pop', u'alternative', u'rock']"
1espa,"[u'indie', u'smooth', u'brillian', u'indie pop', u'beautiful', u'soothing']"
1csa5,"[u'singer-songwriter', u'alt-country', u'rock', u'kansas city', u'americana', u'folk']"
1dp5k,"[u'house', u'dance', u'electronic', u'club']"
1bptt,"[u'alt-country', u'local', u'sxsw 2011']"
1bx5q,"[u'indie', u'indie rock', u'alt-country', u'rock', u'alternative']"
1bdkk,"[u'singer-songwriter', u'alt-country', u'rock', u'indie', u'folk']"
1berf,"[u'folk', u'blues', u'alt-country', u'singer-songwriter', u'americana', u'country']"
1bxj3,"[u'alt-country', u'nashville', u'kickasstic', u'pay attention', u'recommended', u'indie', u'americana']"
1aq2h,"[u'alt-country', u'cowpunk', u'alt country', u'cow punk', u'indie', u'pub rock', u'psychobilly', u'old-time revival', u'country rock', u'rockabilly']"
1berb,"[u'folk', u'blues', u'alt-country', u'singer-songwriter', u'americana', u'country']"
1berc,"[u'folk', u'blues', u'alt-country', u'singer-songwriter', u'americana', u'country']"
1bdkm,"[u'singer-songwriter', u'alt-country', u'rock', u'indie', u'folk']"
1bdxz,"[u'folk', u'singer-songwriter', u'alt-country', u'teh typos', u'diana', u'killforpeace', u'names', u'interesting', u'americana', u'the merch grrls']"
1bc3v,"[u'hip hop', u'2010s', u'stargate', u'2011', u'bev g', u'male vocalists', u'pop']"
1bbds,"[u'folk rock', u'singer-songwriter', u'alt-country', u'seattle', u'northwest', u'americana']"
1bdk7,"[u'singer-songwriter', u'alt-country', u'rock', u'indie', u'folk']"
1bera,"[u'folk', u'blues', u'alt-country', u'singer-songwriter', u'americana', u'country']"
1bdm3,"[u'electro', u'french touch', u'2010s', u'nu rave', u'electronica']"
1awtf,"[u'indie', u'downtempo', u'rock', u'chillout', u'daytrotter', u'champaign-urbana', u'psychedelic', u'ambient', u'alternative', u'www daytrotter sessions']"
122mx,"[u'country', u'female vocalist', u'folk', u'singer-songwriter', u'alt-country']"
qdje,"[u'folk', u'singer-songwriter', u'americana', u'alt-country', u'country', u'townes van zandt', u'townes', u'acoustic', u'today', u'six feet under']"
1bbdx,"[u'folk rock', u'singer-songwriter', u'alt-country', u'seattle', u'northwest', u'americana']"
1atc2,"[u'southern rock', u'country', u'americana', u'singer-songwriter', u'alt-country']"
18kgj,"[u'folk', u'alt country']"
1bdk6,"[u'singer-songwriter', u'alt-country', u'rock', u'indie', u'folk']"
1bdkc,"[u'singer-songwriter', u'alt-country', u'rock', u'indie', u'folk']"
1a055,"[u'alt-country', u'rock', u'ohio', u'athens', u'dayton']"
1bbvs,"[u'mpsvd-luisterpaal-j', u'american', u'iowan', u'folk', u'male vocals']"
19mrn,"[u'alt-country', u'nashville', u'kickasstic', u'pay attention', u'recommended', u'indie', u'americana']"
1bbhp,[u'acerbic']
1b90q,"[u'morning maniac music', u'2010s', u'2011']"
10hkx,"[u'alt-country', u'indie rock', u'americana', u'vocal harmony', u'juddery bass', u'mother american night', u'catchy', u'country rock', u'alternative', u'sweet harmony']"
bj2x,"[u'indie', u'indie rock', u'rock', u'alt-country', u'folk', u'alternative', u'chuck', u'gossip girl', u'happy', u'claps']"
19ad0,"[u'alt-country', u'local', u'sxsw 2011']"
18d25,"[u'folk', u'rock', u'seattle', u'alt-country', u'american', u'americana']"
1berk,"[u'folk', u'blues', u'alt-country', u'singer-songwriter', u'americana', u'country']"
